NCT Number,Study Title,Study URL,Acronym,Study Status,Brief Summary,Study Results,Conditions,Interventions,Primary Outcome Measures,Secondary Outcome Measures,Other Outcome Measures,Sponsor,Collaborators,Sex,Age,Phases,Enrollment,Funder Type,Study Type,Study Design,Other IDs,Start Date,Primary Completion Date,Completion Date,First Posted,Results First Posted,Last Update Posted,Locations,Study Documents
NCT02709512,Ph 2/3 Study in Subjects With MPM to Assess ADI-PEG 20 With Pemetrexed and Cisplatin,https://clinicaltrials.gov/study/NCT02709512,ATOMIC,COMPLETED,"This is a study of ADI-PEG 20 (pegylated arginine deiminase), an arginine degrading enzyme versus placebo in patients with malignant pleural mesothelioma. Malignant pleural mesothelioma have been found to require arginine, an amino acid. Thus the hypothesis is that by restricting arginine with ADI-PEG 20, the malignant pleural mesothelioma cells will starve and die.",YES,Mesothelioma,DRUG: ADI-PEG 20 plus Pem Platinum|OTHER: Placebo plus Pem Platinum,"Response Rate, Objective Response Rate is calculated as the proportion of subjects whose best tumor response from all post-baseline tumor assessments is complete response (CR) or partial response (PR). The best tumor response is the best response recorded from the start of the treatment until the end of treatment taking into account any requirement for confirmation.

To test Objective Response Rate significance, a Relative Risk Ratio (ADI-PEG 20 / Placebo) was calculated as the common relative risk of having a response (CR or PR) based on the Mantel-Haenszel estimator controlling for tumor histology (biphasic versus sarcomatoid)., approximately 18 months|Overall Survival Phase 3 Interim Analysis, The primary analysis of OS Phase 3 was performed at the interim analysis. This was performed once 50% of the planned OS events for phase 3 have occurred (ie, 169 of the 338 planned OS events). This interim analysis will evaluate OS in the ITT population in an unblinded manner. The OS data at the second interim analysis will be analyzed to support the following decisions:

Futility stopping: Terminate the study due to futility at the interim analysis. Sample size re-estimation: Increase the target number of OS events after the second interim analysis.. The treatment effect on OS will be evaluated using the stratified log-rank test (stratified by tumor histology)., Approximately 18 months|Overall Survival, Overall survival is defined as the time from randomization until death. In the event that no death was documented prior to study termination or analysis cutoff, OS was censored at the last known date the subject was known to be alive, either through completion of on-study visits or through survival follow-up contact.

The treatment effect on OS was evaluated using the stratified log-rank test (stratified by tumor histology).

The Kaplan-Meier curves were also plotted. A Cox proportional hazard model with an adjustment for tumor histology (biphasic vs sarcomatoid) was used to compute the estimated hazard ratio and two-sided 95% CI. The treatment effect on OS was evaluated using the stratified log-rank test (stratified by tumor histology). The significance level to be used in the OS analysis at the final analysis was based on α = 0.04999 (two-sided)., 18 months","Progression Free Survival, The key secondary endpoint for the phase 3 portion is PFS, which will be analyzed only if the analysis of OS is statistically significant at the final analysis, with alpha level of 0.05 (two-sided) using the same statistical methodologies as applied to OS., approximately 18 months",,Polaris Group,,ALL,"ADULT, OLDER_ADULT",PHASE2|PHASE3,249,INDUSTRY,INTERVENTIONAL,"Allocation: RANDOMIZED|Intervention Model: PARALLEL|Masking: TRIPLE (PARTICIPANT, CARE_PROVIDER, INVESTIGATOR)|Primary Purpose: TREATMENT",POLARIS2015-003,2017-08-01,2022-08-15,2022-08-15,2016-03-16,2023-10-04,2023-10-04,"Mayo Clinic, Phoenix, Arizona, 85054, United States|UCLA Hematology & Oncology - Santa Monica, Los Angeles, California, 90095, United States|University of California San Francisco Helen Diller Comprehensive Cancer Center, San Francisco, California, 94115, United States|H. Lee Moffitt Cancer Center & Research Institute, Tampa, Florida, 33612, United States|University of Chicago, Chicago, Illinois, 60637, United States|University of Maryland, Marlene & Stewart Greenebaum Comprehensive Cancer Center, Baltimore, Maryland, 21201, United States|Henry Ford Hospital, Detroit, Michigan, 48202, United States|Mayo Clinic, Rochester, Minnesota, 55905, United States|Memorial Sloan Kettering Cancer Center, New York, New York, 10065, United States|MD Anderson Cancer Center, Houston, Texas, 77030, United States|Chris O'Brien Lifehouse, Camperdown, New South Wales, 2050, Australia|Tweed Hospital (NNSW LHD), Tweed Heads, New South Wales, 2486, Australia|Princess Alexandria Hospital and Health Services, Woolloongabba, Queensland, 4102, Australia|Southern Adelaide Local Health Network, Inc., Bedford Park, South Australia, 5042, Australia|Austin Health, Heidelberg, Victoria, 3084, Australia|Sir Charles Gairdner Hospital, Perth, Western Australia, 6009, Australia|SS. Antonio e Biagio e Cesare Arrigo Hospital, Alessandria, AL, 15121, Italy|Humanitas Gavazzeni, Bergamo, BG, 24125, Italy|Ospedale Villa Scassi, Genova, GE, 16149, Italy|Azienda Ospedaliera San Gerardo - Monza, Chirurgia Toracica, Monza, MB, 20900, Italy|European Institute of Oncology, Milano, MI, 20141, Italy|Fondazione IRCCS Policlinico San Matteo, Pavia, PV, 27100, Italy|Fondazione IRCCS - Istituto Nazionale dei Tumori Milano, Milan, 20133, Italy|Azienda Ospedaliero Universitaria di Parma, Parma, 43126, Italy|Azienda Ospedaliero Universitaria Pisana, Pisa, 56124, Italy|Kaohsiung Medical University Chung-Ho Memorial Hospital, Kaohsiung, 807, Taiwan|Chang Gung Medical Foundation Kaohsiung, Kaohsiung, 83301, Taiwan|Taichung Veterans General Hospital, Taichung, 407, Taiwan|National Taiwan University Hospital, Taipei, 10002, Taiwan|Taipei Veterans General Hospital, Taipei, 112, Taiwan|Chang Gung Memorial Foundation LinKou Branch, Taoyuan, 33305, Taiwan|Addenbrooke's Hospital, Cambridge, Cambridgeshire, CB20QQ, United Kingdom|Plymouth Hospitals (Derriford Hospital), Plymouth, Devon, PL6 8DH, United Kingdom|Centre for Experimental Cancer Medicine (CECM), London, England, EC1M 6BQ, United Kingdom|Southampton General Hospital, Southampton, Hampshire, SO16 6YD, United Kingdom|University Hospitals Leicester, Leicester, Leicestershire, LE1 5WW, United Kingdom|Scunthorpe General Hospital, Scunthorpe, North Lincolnshire, DN15 7BH, United Kingdom|Wansbeck General Hospital, Ashington, Northumberland, NE63 9JJ, United Kingdom|Oxford Cancer and Haematology Centre, The Churchill Hospital, Oxford, Oxfordshire, OX3 7LE, United Kingdom|Velindre Cancer Centre, Cardiff, CF14 2TL, United Kingdom|Edinburgh Cancer Centre, Edinburgh, EH4 2XU, United Kingdom|Beatson West of Scotland Cancer Centre, Glasgow, G12 0YN, United Kingdom|St James's University Hospital, Leeds, LS9 7TF, United Kingdom|St Bartholomew's Hospital, London, EC1A 7BE, United Kingdom|University Hospital of South Manchester, Manchester, M23 9LT, United Kingdom","Study Protocol and Statistical Analysis Plan, https://cdn.clinicaltrials.gov/large-docs/12/NCT02709512/Prot_SAP_000.pdf"
