NCT Number,Study Title,Study URL,Acronym,Study Status,Brief Summary,Study Results,Conditions,Interventions,Primary Outcome Measures,Secondary Outcome Measures,Other Outcome Measures,Sponsor,Collaborators,Sex,Age,Phases,Enrollment,Funder Type,Study Type,Study Design,Other IDs,Start Date,Primary Completion Date,Completion Date,First Posted,Results First Posted,Last Update Posted,Locations,Study Documents
NCT03079011,PAlbociclib and Circulating Tumor DNA for ESR1 Mutation Detection,https://clinicaltrials.gov/study/NCT03079011,PADA-1,ACTIVE_NOT_RECRUITING,"This study is a randomized, open-label, multicentric, phase III trial conducted in patients receiving aromatase inhibitor and palbociclib as first line therapy for estrogen receptor (ER)-positive HER2-negative metastatic breast cancer and which aims to evaluate, at the onset of ESR1 mutations in circulating tumor DNA, the efficacy of a change of the hormone therapy (aromatase inhibitor (AI) changed to fulvestrant) combined to palbociclib, together with the safety of hormone therapy and palbociclib combination in the overall population.",NO,Metastatic Breast Cancer,DRUG: Palbociclib 125mg|DRUG: Aromatase Inhibitors|DRUG: Fulvestrant Injectable Product,"Incidence of treatment-emergent Adverse Events, Global safety of the combination of palbociclib + endocrine therapy in the whole population, with focus on hematological toxicities.

Safety will be assessed by the collection of grade ≥3 adverse events, using the Common Terminology Criteria for Adverse Events (CTCAE), version 4.03 - in all included patients., Throughout study completion, up to 4 years|Progression-free survival (Step 2), To assess whether a change of the hormone therapy associated with palbociclib will benefit patients for whom rising ESR1 mutations are detected during treatment with palbociclib and aromatase inhibitor.

Progression-Free Survival (PFS) will be measured from the time of randomization to the time of tumor progression (as assessed by the investigator per RECIST v1.1) or death (whichever comes first) - in randomized patients., From randomization to disease progression or death, up to 4 years","Progression-free survival (step 3), To assess PFS in patients undergoing a cross-over following RECIST tumor progression in Arm A, from the start of crossover.

Progression-Free Survival will be measured from the time of cross-over to the time of tumor progression (as assessed by the investigator per RECIST 1.1) or death (whichever comes first) - in all patients with crossover, From cross-over, up to 4 years|Progression-free survival (step 1&2), To report efficacy (PFS based on RECIST) of palbociclib combined with hormone therapy (aromatase inhibitor or fulvestrant), from the date of initial inclusion into the trial.

Progression-Free Survival will be measured from the time of inclusion to the time of tumor progression (as assessed by the investigator per RECIST 1.1) or death (whichever comes first) - in all included patients including those who switched to fulvestrant., From inclusion, up to 4 years|Time to strategy failure from randomization (Step 2 and 3), To assess whether the early switch (switch following ESR1 mutations increase) to fulvestrant contributes to a longer time to strategy failure than a late switch (cross-over following RECIST tumor progression).

Time to strategy failure will be measured from the time of randomization until palbociclib+endocrine therapy discontinuation or death (whichever comes first) - in all randomized patients., From randomization, up to 4 years|Chemotherapy-free survival (Step 2 and 3), To assess whether the early switch (following ESR1 mutations increase) to fulvestrant contributes a longer chemotherapy-free survival than a late switch (cross-over following RECIST tumor progression).

Chemotherapy-free survival will be measured from the time of randomization until the date of chemotherapy initiation or death (whichever comes first) - in all randomized patients., From randomization, up to 4 years|Incidence of treatment-emergent extra-hematological Adverse Events, To obtain additional safety data in a broad patient population treated with palbociclib and hormone therapy (aromatase inhibitor or fulvestrant) in a general Description of all extra-hematological grade ≥3 toxicities and SAEs incidence rate in the overall population and each treatment step, Throughout study completion, up to 4 years|Quality of life by quality of life questionnaire (QLQ)-C30, Developed by the EORTC, this self-reported questionnaire assesses the health-related quality of life of cancer patients in clinical trials.

The questionnaire includes five functional scales (physical, everyday activity, cognitive, emotional, and social), three symptom scales (fatigue, pain, nausea and vomiting), a health/quality of life overall scale, and a number of additional elements assessing common symptoms (including dyspnea, loss of appetite, insomnia, constipation, and diarrhea), as well as, the perceived financial impact of the disease.

All of the scales and single-item measures range in score from 0 to 100. A high scale score represents a higher response level., From inclusion and every 2 months until disease progression, up to 2 years|Other line of therapy, To report the anti-cancer treatments received after the first line therapy., Throughout study completion, up to 4 years|Overall Survival, The overall survival is the length of time from inclusion that patients enrolled in the study are still alive., Throughout study completion, up to 4 years",,UNICANCER,Pfizer,FEMALE,"ADULT, OLDER_ADULT",PHASE3,1017,OTHER,INTERVENTIONAL,Allocation: RANDOMIZED|Intervention Model: SEQUENTIAL|Masking: NONE|Primary Purpose: TREATMENT,UC-0140/1615 - UCBG3-05|2016-004360-18,2017-03-22,2021-04-30,2025-06-30,2017-03-14,,2024-11-12,"Centre Hospitalier Universitaire, Amiens, France|Clinique de l'Europe, Amiens, France|Institut de Cancérologie de l'Ouest - Site Paul Papin, Angers, France|Centre Hospitalier d'Auxerre, Auxerre, France|Institut Sainte Catherine, Avignon, France|Centre Hospitalier de Beauvais, Beauvais, France|Centre Hospitalier de Blois, Blois, France|Clinique Tivoli Ducos, Bordeaux, France|Institut Bergonié, Bordeaux, France|Polyclinique Bordeaux Nord Aquitaine, Bordeaux, France|Centre Hospitalier de boulogne sur Mer, Boulogne Sur Mer, France|Centre Hospitalier Fleyriat, Bourg En Bresse, France|CHRU Morvan, Brest, France|Clinique PASTEUR-CFRO, Brest, France|Centre Francois Baclesse, Caen, France|Centre Hospitalier René Dubos, Cergy - Pontoise, France|Medipole de Savoie, Challes Les Eaux, France|Centre Hôpital Sainte Marie, Chalon-sur-saone, France|CH William Morey, Chalon-sur-saone, France|Centre Hospitalier Métropole de Savoie, Chambery, France|Centre Hospitalier de Cholet, Cholet, France|Centre Jean Perrin, Clermont-ferrand, France|Pôle Santé République, Clermont-ferrand, France|Centre Georges François Leclerc, Dijon, France|CHI Fréjus St-Raphaël, Frejus, France|Institut Daniel Hollard - Groupe Hospitalier Mutualiste de Grenoble, Grenoble, France|Centre Hospitalier Départemental de Vendée, La Roche Sur Yon, France|Clinique du Cap d'Or, La Seyne-sur-Mer, France|Centre Hospitalier de Versailles, Le Chesnay, France|Centre Hospitalier le Mans, Le Mans, France|Institut Hospitalier Franco-Britannique, Levallois-perret, France|CHU Dupuytren, Limoges, France|Clinique François Chénieux, Limoges, France|Centre Hospitalier Bretagne Sud, Lorient, France|Centre Leon Berard, Lyon, France|Clinique de la Sauvegarde, Lyon, France|Hôpital privé Jean Mermoz, Lyon, France|Centre d'Oncologie radiothérapie de Macon, Macon, France|Hôpital Européen Marseille, Marseille, France|Hôpital Saint Joseph, Marseille, France|Institut Paoli Calmettes, Marseille, France|Centre Hospitalier ANNECY GENEVOIS, Metz-Tessy, France|Clinique Claude Bernard, Metz, France|CH Mont de Marsan, Mont de Marsan, France|Centre Hospitalier Montceau les mines, Montceau-les-mines, France|ICM - Val d'Aurelle, Montpellier, France|Centre d'Oncologie de Gentilly, Nancy, France|Hopital Privé du Confluent, Nantes, France|Centre Antoine Lacassagne, Nice, France|Centre ONCOGARD - Institut de Cancérologie du Gard, Nimes, France|Institut Curie, Paris, 75005, France|Hopital Diaconesses-Croix Saint Simon, Paris, France|Hopital Européen Georges Pompidou, Paris, France|Saint Louis Hospital, Paris, France|Centre Hospitalier de Pau, PAU, France|Polyclinique Francheville, Perigueux, France|Centre Catalan d'Oncologie, Perpignan, France|Centre Hospitalier Lyon Sud, Pierre-benite, France|CARIO - Centre Armoricain Radiothérapie Imagerie Médicale et Oncologi, Plerin, France|Centre Hospitalier de Cornouaille, Quimper, France|Clinique de la Croix du Sud, Quint Fonsegrives, France|Centre Eugène Marquis, Rennes, France|Centre de radiothérapie et d'oncologie médicale LE-CROME, Ris Orangis, France|Centre Henri Becquerel, Rouen, France|CHP Saint Grégoire, Saint Gregoire, France|Institut de cancérologie lucien Neuwith, Saint Priest En Jarez, France|Centre Hospitalier Saint-Brieuc, Saint-Brieuc, France|Institut Curie - Hôpital René Huguenin, Saint-cloud, France|Institut de Cancérologie de l'Ouest - Site René Gauducheau, Saint-herblain, France|Centre Hospitalier de Broussais, Saint-malo, France|Clinique Mutualiste de l'Estuaire, Saint-nazaire, France|Centre Paul Stauss, Strasbourg, France|Clinique de l'Orangerie, Strasbourg, France|Clinique Sainte Anne, Strasbourg, France|Hôpitaux Universitaires de Strasbourg, Strasbourg, France|Hôpitaux du Léman, Thonon-les-Bains, France|Clinique Pasteur, Toulouse, France|Institut Claudius Regaud, Toulouse, France|Centre Hospitalier de Tours - Hopital Bretonneau, Tours, France|Centre Hospitalier Bretagne Atlantique, Vannes, France|UNEOS Site Hôpital Robert Schuman, Vantoux, France|Gustave Roussy, Villejuif, 94805, France",
