NCT Number,Study Title,Study URL,Acronym,Study Status,Brief Summary,Study Results,Conditions,Interventions,Primary Outcome Measures,Secondary Outcome Measures,Other Outcome Measures,Sponsor,Collaborators,Sex,Age,Phases,Enrollment,Funder Type,Study Type,Study Design,Other IDs,Start Date,Primary Completion Date,Completion Date,First Posted,Results First Posted,Last Update Posted,Locations,Study Documents
NCT00677443,Study of S-1 and Oxaliplatin (SOX) Versus Capecitabine and Oxaliplatin (COX) in Patients With Advanced Colorectal Cancer,https://clinicaltrials.gov/study/NCT00677443,,COMPLETED,"Primary objective :

To compare the combination of S-1 and oxaliplatin(SOX) to the combination of capecitabine and oxaliplatin(COX) therapy for advanced or metastatic colorectal carcinoma.

Secondary objectives :

1. To evaluate and compare the efficacy (overall survival and response rate) in the two treatment groups.
2. To evaluate and compare the quality of life of the patients and safety profiles of the two treatment groups.",NO,Colorectal Cancer,DRUG: S-1 & Oxaliplatin|DRUG: Capecitabine & Oxaliplatin,"To compare the combination of S-1 and oxaliplatin to the combination of capecitabine and oxaliplatin in terms of progression free survival in patients previously untreated by systemic therapy for advanced or metastatic colorectal carcinoma., 9 months","To evaluate and compare the efficacy (overall survival and response rate) in the two treatment groups., 24 months|To evaluate and compare the quality of life of the patients and safety profiles of the two treatment groups., 24 months",,Samsung Medical Center,"National Cancer Center, Korea|Seoul National University Bundang Hospital|Seoul National University Hospital|Gachon University Gil Medical Center|Yonsei University|Asan Medical Center|Chonnam National University Hospital",ALL,"ADULT, OLDER_ADULT",PHASE3,344,OTHER,INTERVENTIONAL,Allocation: RANDOMIZED|Intervention Model: PARALLEL|Masking: NONE|Primary Purpose: TREATMENT,2008-03-012,2008-06,2009-09,2011-01,2008-05-14,,2013-06-14,"National Cancer Center, Goyang, Gyeonggi, 410-769, Korea, Republic of|Seoul National University Bundang Hospital, Seongnam, Gyeonggi, Korea, Republic of|Chonnam National University Hospital, Hwasun, Jeollanamdo, 519-809, Korea, Republic of|Yeungnam University, Daegu, 705-717, Korea, Republic of|Gachon University Gil Medical Center, Inchon, Korea, Republic of|Samsung Medical Center, Seoul, 135-710, Korea, Republic of|Asan Medical Center, Seoul, 138-736, Korea, Republic of|Korea Cancer Center Hospital, Seoul, 139-706, Korea, Republic of|Soon Chun Hyang University Hospital, Seoul, 140-743, Korea, Republic of|Seoul National University Hospital, Seoul, Korea, Republic of|Yonsei University, Seoul, Korea, Republic of",
