NCT Number,Study Title,Study URL,Acronym,Study Status,Brief Summary,Study Results,Conditions,Interventions,Primary Outcome Measures,Secondary Outcome Measures,Other Outcome Measures,Sponsor,Collaborators,Sex,Age,Phases,Enrollment,Funder Type,Study Type,Study Design,Other IDs,Start Date,Primary Completion Date,Completion Date,First Posted,Results First Posted,Last Update Posted,Locations,Study Documents
NCT01208766,Study to Compare VMP With HDM Followed by VRD Consolidation and Lenalidomide Maintenance in Patients With Newly Diagnosed Multiple Myeloma,https://clinicaltrials.gov/study/NCT01208766,HO95,ACTIVE_NOT_RECRUITING,"Study phase: phase III

Study objective:

* Comparison of Bortezomib, Melphalan, Prednisone (VMP) with High Dose Melphalan followed autologous stem cell transplantation (ASCT)
* Comparison of Bortezomib, Lenalidomide, Dexamethasone(VRD) as consolidation versus no consolidation
* Comparison of single versus tandem high dose Melphalan with ASCT

Patient population: Patients with symptomatic multiple myeloma,previously untreated, ISS stages 1-3, age 18-65 years inclusive

Study design: Prospective, multicenter, intergroup, randomized

Duration of treatment: Expected duration of induction, stem cell collection and intensification is 6 - 9 months. Consolidation with VRD will last 2 months Maintenance therapy with Lenalidomide will be given until relapse. All patients will be followed until 10 years after registration.",NO,Multiple Myeloma,"DRUG: Bortezomib, Melphalan, Prednisone (VMP)|DRUG: 1 or 2 cycle(s) HDM (High Dose Melphalan)|DRUG: 2 cycles of Bortezomib, Lenalidomide, Dexamethasone (VRD)","For all registered patients: progression free survival (PFS) as defined by time from registration to progression or death from any cause (whichever occurs first)., For all registered patients: progression free survival (PFS) as defined by time from registration to progression or death from any cause (whichever occurs first)., end of trial (last patient last visit)|For all patients included in R1; PFS as defined by time from randomization R1 to progression or death from any cause whichever comes first, For all patients included in R1; PFS as defined by time from randomization R1 to progression or death from any cause whichever comes first, end of trial (last patient last visit)|For all patients included in R2; PFS as defined by time from randomization R2 to progression or death from any cause whichever comes first, For all patients included in R2; PFS as defined by time from randomization R2 to progression or death from any cause whichever comes first, end of trial (last patient last visit)","Overall survival measured from the time of registration /randomization R1/ randomization R2. Patients still alive or lost to follow up are censored at the date they were last known to be alive., Overall survival measured from the time of registration /randomization R1/ randomization R2.

Patients still alive or lost to follow up are censored at the date they were last known to be alive., end of trial (last patient last visit)|Toxicity, Toxicity, End of trial (last patient last visit)|Response (PR, VGPR, CR and stringent CR), and improvement of response during the various stages of the treatment., Response (PR, VGPR, CR and stringent CR), and improvement of response during the various stages of the treatment., end of trial (last patient last visit)",,Stichting Hemato-Oncologie voor Volwassenen Nederland,Stichting European Myeloma Network|Gruppo Italiano Malattie EMatologiche dell'Adulto|DSMM (Deutsche Studiengruppe Multiples Myelom)|NMSG (Nordic Myeloma Study Group)|Central European Myeloma Study Group,ALL,"ADULT, OLDER_ADULT",PHASE3,1503,OTHER,INTERVENTIONAL,Allocation: RANDOMIZED|Intervention Model: PARALLEL|Masking: NONE|Primary Purpose: TREATMENT,HOVON 95 MM|2009-017903-28|EMN02,2011-01,2020-12,2025-01,2010-09-24,,2024-08-21,"AU-Brisbane-PAH, Brisbane, Australia|AU-Canberra-CANBERRAHOSPITAL, Canberra, Australia|AU-Melbourne-ALFRED, Melbourne, Australia|AU-Sydney-CONCORD, Sydney, Australia|AU-Sydney-NEPEAN, Sydney, Australia|Prince of Wales Hospital, Sydney, Australia|St George Hospital, Sydney, Australia|Krankenhaus d.Elisabethinen, Linz, Austria|Landeskrankenhaus Salzburg, Salzburg, Austria|AT-Vienna-HANUSCH, Vienna, Austria|BE-Antwerpen Edegem-UZA, Antwerpen, Belgium|BE-Antwerpen-ZNASTUIVENBERG, Antwerpen, Belgium|BE-Haine-Saint-Paul-JOLIMONT, Haine-Saint-Paul, Belgium|CHU Tivoli, La Louvière, Belgium|BE-Liege-CHRCITADELLE, Liège, Belgium|BE-Mons-AMBROISE, Mons, Belgium|CHR Saint Joseph, Mons, Belgium|BE-Roeselare-AZDELTA, Roeselare, Belgium|RHMS, Saint-Ghislain, Belgium|CH Wapi, Tournai, Belgium|AZ Turnhout, Turnhout, Belgium|CZ-Brno-UHBRNO, Brno, Czechia|Kralove-University Hospital Hradec Kralove, Hradec, Czechia|CZ-Olomouc-FNOL, Olomouc, Czechia|CZ-Ostrava-Poruba-FNO, Ostrava, Czechia|University Hospital Plzen, Plzen, Czechia|University Hospital Kralovske Vinohrady, Prague, Czechia|DK-Aalborg-AALBORGUH, Aalborg, Denmark|DK-Aarhus N-AUH, Aarhus, Denmark|DK-Copenhagen-RIGSHOSPITALET, Copenhagen, Denmark|DK-Herlev-HERLEV, Herlev, Denmark|DK-Odense-OUH, Odense, Denmark|DK-Roskilde-ROSKILDE, Roskilde, Denmark|FI-Turku-TYKS, Turku, Finland|GR-Athens-ALEXANDRA, Athens, Greece|St. Istvan and St. Laszlo Korhaz Hospital, Budapest, Hungary|Szeged University Hospital, Szeged, Hungary|SS Antonio e Biogio, Alessandria, Italy|AOU Umberto I-Clinica di Ematologica, Ancona, Italy|Ospedale C. e G. Mazzoni-Ematologia, Ascoli Piceno, Italy|A.O.R.N. San G. Moscati, Avellino, Italy|Policlinico di Bari, Bari, Italy|Oaspedali Riuniti_Div di Ematologia, Bergamo, Italy|Instituto di Ematologia e Oncologia Medica, Bologna, Italy|Ospedale Generale Regionale_Div di Ema e Centro, Bolzano, Italy|Spedali Civili_U.O.Ematologia, Brescia, Italy|Pres Osp Di Summa, Brindisi, Italy|Presidio Osp R. Binaghi, Cagliari, Italy|Inst per la Ricerca e la Cura del Cancro Di, Candiolo, Italy|Ospedale Ferrarotto-Ema, Catania, Italy|Presidio ospedaliero dell'annunziata, Cosenza, Italy|OspedaleCivico S Croce e carle, Cuneo, Italy|Ospedali Riuniti di Foggia, Foggia, Italy|Azienda Ospedaliera San Antonio Abate, Gallarate, Italy|Azienda Ospedaliera Universitaria S. Martino_Clinica Ematologica, Genova, Italy|Azienda Ospedaliera Universitaria S. Martino_Ematologia 1, Genova, Italy|Azienda Ospedaliera Universitaria S. Martino_Ematologia 2, Genova, Italy|Università La Sapienza Polo Pontino, Latina, Italy|Ospedale A. Manzoni, Lecco, Italy|ASUR Regione Marche, Marche, Italy|IRST, Meldola, Italy|Azienda Ospedaliera Papardo, Messina, Italy|Policlinico Gaetano Martino, Messina, Italy|Osp Dell Angelo, Mestre, Italy|Istituto Nazionale dei Tumori-Ema, Milano, Italy|Ospedale Niguarda Cà Grande, Milano, Italy|Policlinico- servizio di Ematologia, Modena, Italy|Ospedale Cardarelli-ematologia e Trapianto di Midollo Osseo, Napoli, Italy|Ospedale Cardarelli-Sezione di Ematologia TERE, Napoli, Italy|Universita Federico II-Ema, Napoli, Italy|Università Amedeo Avogrado-Ospedale Maggiore, Novara, Italy|Ospedale San Francesco, Nuoro, Italy|Osp San Luigi Gonzaga-Pat med, Orbassano, Italy|Ospedaliera di Pavona_Ematologia e, Padova, Italy|Giaccone di Palermo, Palermo, Italy|Fondazione Maugeri, Pavia, Italy|Policlinico San Matteo, Pavia, Italy|Azienda Ospedaliera S. Maria della Misericordia, Perugia, Italy|AO Ospedali Riunti Marche Nord, Pesaro, Italy|Presidio Osp dello Spirito Santo, Pescara, Italy|Osp S Maria delle Croci_Ema, Ravenna, Italy|A.O. Bianchi Melacrino Morelli_Ops Riunti, Reggio Calabria, Italy|Azienda Ospedaliera S. Maria Nuova, Reggio Emilia, Italy|Ospedale Infermi, Rimini, Italy|Ospedale Oncologica Regionale, Rionero In Vulture, Italy|Azienda Osp S. Andrea, Roma, Italy|Inst Regina elena-SC Ema IFO, Roma, Italy|Osp. san Camillo Forlanini, Roma, Italy|Ospedale S Eugenio_Ema, Roma, Italy|Ospedale San Giovanni Addolorata, Roma, Italy|UC Biomedico_Divisione di Ematologia, Roma, Italy|Universita La Sapienza_Ospedale Umberto I, Roma, Italy|Istituto Clinico Humanitas, Rozzano, Italy|AOU Senese Policlinico S. Maria alle Scotte, Siena, Italy|PO SS Ann e S.G. Moscati-Ema, Taranto, Italy|St. Maria_Oncoematologia, Terni, Italy|San Giovanni Battista Le Molinette-Ema 1, Torino, Italy|San Giovanni Battista Le Molinette-Ema 2, Torino, Italy|AO Cardinale G. Panico, Tricase, Italy|AOU Ospedali Riuniti, Trieste, Italy|AOU S.Maria della Misericordia, Udine, Italy|LU-Luxembourg-CHL, Luxembourg, Luxembourg|NL-Alkmaar-NWZ, Alkmaar, Netherlands|NL-Almere-FLEVOZIEKENHUIS, Almere, Netherlands|NL-Amersfoort-MEANDERMC, Amersfoort, Netherlands|NL-Amstelveen-AMSTELLAND, Amstelveen, Netherlands|NL-Amsterdam-AMC, Amsterdam, Netherlands|NL-Amsterdam-AVL, Amsterdam, Netherlands|NL-Amsterdam-OLVG, Amsterdam, Netherlands|NL-Amsterdam-VUMC, Amsterdam, Netherlands|NL-Apeldoorn-GELREAPELDOORN, Apeldoorn, Netherlands|NL-Arnhem-RIJNSTATE, Arnhem, Netherlands|NL-Assen-WZA, Assen, Netherlands|NL-Beverwijk-RKZ, Beverwijk, Netherlands|NL-Breda-AMPHIA, Breda, Netherlands|NL-Capelle a/d IJssel-YSL, Capelle Aan Den IJssel, Netherlands|NL-Delft-RDGG, Delft, Netherlands|NL-Den Bosch-JBZ, Den Bosch, Netherlands|NL-Den Haag-HAGA, Den Haag, Netherlands|NL-Deventer-DZ, Deventer, Netherlands|NL-Dirksland-VANWEELBETHESDA, Dirksland, Netherlands|NL-Doetinchem-SLINGELAND, Doetinchem, Netherlands|NL-Dordrecht-ASZ, Dordrecht, Netherlands|Nij Smellinghe, Drachten, Netherlands|NL-Ede-ZGV, Ede, Netherlands|NL-Eindhoven-CATHARINA, Eindhoven, Netherlands|NL-Eindhoven-MAXIMAMC, Eindhoven, Netherlands|NL-Emmen-SCHEPER, Emmen, Netherlands|NL-Enschede-MST, Enschede, Netherlands|NL-Geldrop-STANNA, Geldrop, Netherlands|NL-Goes-ADRZ, Goes, Netherlands|NL-Gorinchem-BEATRIX, Gorinchem, Netherlands|NL-Gouda-GROENEHART, Gouda, Netherlands|NL-Groningen-UMCG, Groningen, Netherlands|NL-Heerlen-ATRIUMMC, Heerlen, Netherlands|NL-Helmond-ELKERLIEK, Helmond, Netherlands|NL-Hilversum-TERGOOI, Hilversum, Netherlands|NL-Hoofddorp-SPAARNEGASTHUIS, Hoofddorp, Netherlands|NL-Hoorn-DIJKLANDERHOORN, Hoorn, Netherlands|NL-Leeuwarden-MCL, Leeuwarden, Netherlands|NL-Leiden-LUMC, Leiden, Netherlands|NL-Maastricht-MUMC, Maastricht, Netherlands|NL-Nieuwegein-ANTONIUS, Nieuwegein, Netherlands|NL-Nijmegen-CWZ, Nijmegen, Netherlands|NL-Nijmegen-RADBOUDUMC, Nijmegen, Netherlands|NL-Roermond-LZR, Roermond, Netherlands|NL-Roosendaal-BRAVIS, Roosendaal, Netherlands|NL-Rotterdam-EMCDANIEL, Rotterdam, Netherlands|NL-Rotterdam-ERASMUSMC, Rotterdam, Netherlands|NL-Rotterdam-IKAZIA, Rotterdam, Netherlands|NL-Rotterdam-MAASSTADZIEKENHUIS, Rotterdam, Netherlands|NL-Rotterdam-SFG, Rotterdam, Netherlands|NL-Sittard-Geleen-ZUYDERLAND, Sittard, Netherlands|NL-Spijkenisse-SPIJKENISSEMC, Spijkenisse, Netherlands|NL-Terneuzen-ZORGSAAM, Terneuzen, Netherlands|NL-Tilburg-ETZ, Tilburg, Netherlands|NL-Utrecht-DIAKONESSENUTRECHT, Utrecht, Netherlands|NL-Utrecht-UMCUTRECHT, Utrecht, Netherlands|NL-Venlo-VIECURI, Venlo, Netherlands|NL-Winterswijk-SKBWINTERSWIJK, Winterswijk, Netherlands|NL-Zwolle-ISALA, Zwolle, Netherlands|Haukeland University Hospital, Bergen, Norway|Forde Central Hosiptal, Førde, Norway|Harstad University Hospital, Harstad, Norway|Sørlandet Hospital, Kristiansand, Norway|Levanger Hospital, Levanger, Norway|NO-Lørenskog-AKERSHUS, Lørenskog, Norway|NO-Oslo-OSLOUH, Oslo, Norway|Baerum hospital, Sandvika, Norway|NO-Stavanger-HELSESTAVANGER, Stavanger, Norway|NO-Tromsø-NORTHNOORWEGEN, Tromsø, Norway|NO-Trondheim-STOLAV, Trondheim, Norway|Helse Sunnmore, Ålesund, Norway|Francisco Gentil, Lisboa, Portugal|SE-Boras-SASBORAS, Borås, Sweden|Eskilstuna Malar Hospital, Eskilstuna, Sweden|Falun Hospital, Falun, Sweden|Sahlgrenska University Hospital, Göteborg, Sweden|Hallands Hospital Halmstad, Halmstad, Sweden|Helsingborg General Hospital, Helsingborg, Sweden|Ryhov Hospital, Jönköping, Sweden|Lidkoping Hospital, Lidkoping, Sweden|SE-Linköping-REGIONOSTERGOTLAND, Linköping, Sweden|SE-Luleå-SUNDERBY, Luleå, Sweden|SE-Lund-SUH, Lund, Sweden|SE-Stockholm-KAROLINSKAHUDDINGE, Stockholm, Sweden|Sundsvall Hospital, Sundsvall, Sweden|Uddevall Hospital, Uddevalla, Sweden|Umea University Hospital, Umeå, Sweden|SE-Uppsala-UPPSALAUH, Uppsala, Sweden|Centrallasareltet Vaxjo, Växjö, Sweden|Orebro University Hospital, Örebro, Sweden|CH-Aarau-KSA, Aarau, Switzerland|CH-Basel-USB, Basel, Switzerland|CH-Bellinzona-IOSI, Bellinzona, Switzerland|CH-Bern-INSEL, Bern, Switzerland|KS Graubunden, Chur, Switzerland|CH-Geneve (14)-HCUGE, Geneve, Switzerland|Kantonsspital Baselland, Liestal, Switzerland|CH-Luzern-LUKS, Luzern, Switzerland|CH-St. Gallen-KSSG, Saint Gallen, Switzerland|CH-Zürich-USZ, Zürich, Switzerland|Baskent University Hospital, Adana, Turkey|Gazi University Hospital, Ankara, Turkey|University Hospital Ankara, Ankara, Turkey|Istanbul University Hospital, Istanbul, Turkey|Ege University Hospital, İzmir, Turkey|Erciyes University Hospital, Kayseri, Turkey",
