NCT Number,Study Title,Study URL,Acronym,Study Status,Brief Summary,Study Results,Conditions,Interventions,Primary Outcome Measures,Secondary Outcome Measures,Other Outcome Measures,Sponsor,Collaborators,Sex,Age,Phases,Enrollment,Funder Type,Study Type,Study Design,Other IDs,Start Date,Primary Completion Date,Completion Date,First Posted,Results First Posted,Last Update Posted,Locations,Study Documents
NCT02598661,Study to Evaluate Imetelstat (GRN163L) in Participants With International Prognostic Scoring System (IPSS) Low or Intermediate-1 Risk Myelodysplastic Syndrome (MDS),https://clinicaltrials.gov/study/NCT02598661,,ACTIVE_NOT_RECRUITING,"The purpose of this study is to evaluate the efficacy and safety of imetelstat sodium in transfusion-dependent participants with low or intermediate-1 risk myelodysplastic syndrome (MDS) that is relapsed/refractory to erythropoiesis-stimulating agent (ESA) treatment in Phase 2 study and to compare the efficacy, in terms of red blood cell (RBC) transfusion independence (TI), of imetelstat sodium to placebo in transfusion-dependent participants with low or intermediate-1 risk MDS that is relapsed/refractory to ESA treatment in Phase 3 study.

A separate Ventricular Repolarization Substudy (QTc Substudy) will evaluate the effect of imetelstat sodium on ventricular repolarization.

An Extension Phase has been included to allow continued treatment for those participants who are benefitting from imetelstat sodium and to continue to evaluate the long-term safety, overall survival (OS), and disease progression, including progression to acute myeloid leukemia (AML) in transfusion-dependent participants with low or immediate-1 risk MDS that is relapsed/refractory to ESA treatment.",YES,Myelodysplastic Syndromes,DRUG: Imetelstat Sodium|DRUG: Placebo,"Phase 2: Percentage of Participants Without Any Red Blood Cell (RBC) Transfusion During Any Consecutive 8-Weeks Period (All Participants), Percentage of participants without any RBC transfusion during any consecutive 8 weeks (56 days) starting from Study Day 1 until subsequent anti-cancer therapy if any were reported. Study Day 1 is defined as the day of the first dose for participants enrolled in Phase 2. The 95% confidence interval (CI) was calculated using Clopper-Pearson method. Percentages were rounded off to the nearest single decimal place., Up to 5 years in Phase 2|Phase 2: Percentage of Participants Without Any RBC Transfusion During Any Consecutive 8-Weeks Period in Target Population, Percentage of participants without any RBC transfusion during any consecutive 8 weeks (56 days) starting from Study Day 1 until subsequent anti-cancer therapy if any were reported. Study Day 1 is defined as the day of the first dose for participants enrolled in Phase 2. The 95% confidence interval (CI) was calculated using Clopper-Pearson method. Percentages were rounded off to the nearest single decimal place., Up to 5 years in Phase 2|Phase 3: Percentage of Participants Without Any RBC Transfusion During Any Consecutive 8-Weeks Period, Percentage of participants without any RBC transfusion during any consecutive 8 weeks (56 days) starting from Study Day 1 until subsequent anti-cancer therapy if any were reported. Study Day 1 is defined as the day of the first dose for participants enrolled in Phase 2. The 95% CI was calculated using Clopper-Pearson method. Percentages were rounded off to the nearest single decimal place., Up to 3.7 years in Phase 3","Phase 2 and Phase 3: Number of Participants With Treatment Emergent Adverse Events (TEAEs) and Deaths, TEAEs were defined as those events that 1) occurred after the first dose of study drug, through the treatment phase, and for 30 days following the last dose of study drug or until subsequent anti-cancer therapy if earlier; 2) any event that was considered study drug-related regardless of the start date of the event; or 3) any event that was presented at baseline but worsened in severity or was subsequently considered drug-related by the investigator. Serious TEAEs are any TEAEs that result in death, is life-threatening, requires inpatient hospitalization or prolongation of existing hospitalization, results in persistent or significant disability/incapacity, is a congenital anomaly/birth defect, is a suspected transmission of any infectious agent via a medicinal product, is medically important. Any clinically significant vital sign measurements, clinical laboratory values, and electrocardiogram (ECG) findings were reported as TEAEs. TEAEs included both serious and non-serious TEAEs., Adverse events: Up to 5 years in Phase 2 and up to 3.7 years in Phase 3; Deaths: Up to 6.6 years in Phase 2 and up to 4 years in Phase 3|Phase 2 and Phase 3: Percentage of Participants Without Any RBC Transfusion During Any Consecutive 24-Weeks Period, Percentage of participants without any RBC transfusion during any consecutive 24 weeks (168 days) starting from Study Day 1 until subsequent anti-cancer therapy if any were reported. Study Day 1 is defined as the day of the first dose for participants enrolled in Phase 2 and the day of randomization for participants enrolled in Phase 3. The 95% CI was calculated using Clopper-Pearson method. Percentages were rounded off to the nearest single decimal place., Up to 5 years in Phase 2 and up to 3.7 years in Phase 3|Phase 2 and Phase 3: Time to the 8-Weeks RBC Transfusion Independence (TI), Time to 8-week RBC TI was defined as the interval from Study Day 1 to the first day of the first 8-week RBC TI period., Up to 5 years in Phase 2 and up to 3.7 years in Phase 3|Phase 2 and Phase 3: Time to the 24-Weeks RBC TI, Time to 24-week RBC TI was defined as the interval from Study Day 1 to the first day of the first 24-weeks RBC TI period., Up to 5 years in Phase 2 and up to 3.7 years in Phase 3|Phase 2 and Phase 3: Duration of RBC TI, Duration of RBC TI was defined as the first day of the longest RBC TI period to the date of the first RBC transfusion after the TI period started. The 95% CI was based on Kaplan-Meier product limit estimates., Up to 5 years in Phase 2 and up to 3.7 years in Phase 3|Phase 2 and Phase 3: Percentage of Participants With Hematologic Improvement Including Erythroid Response (HI-E) as Per International Working Group (IWG) Response Criteria 2006, As per IWG Response Criteria 2006: HI-E was defined as a hemoglobin (Hb) increase by greater than or equal to (≥)1.5 grams per deciliter (g/dL) relevant reduction of units of RBC transfusions by an absolute number of at least 4 RBC transfusion units/8 weeks compared with the pretreatment transfusion number in the previous 8 weeks. Only RBC transfusions given for a Hb of less than or equal to (≤)9 g/dL pretreatment were counted in the RBC transfusion response evaluation. The 95% CI was calculated using Clopper-Pearson method. Percentages were rounded off to the nearest single decimal place., Up to 5 years in Phase 2 and up to 3.7 years in Phase 3|Phase 2: Percentage of Participants With Complete Remission (CR), Partial Remission (PR), or Marrow Complete Remission (mCR) as Per International Working Group (IWG) Response Criteria 2006 as Assessed by the Investigator, As per the IWG Response Criteria 2006, CR was defined as Bone marrow: ≤5% myeloblasts with normal maturation of all cell lines; Peripheral blood (PB): Hb ≥11 g/dL; platelets ≥100 x 10\^9/dL; neutrophils ≥1.0 x 10\^9/liter; blasts: 0%. PR was defined as Bone marrow: ≤5% myeloblasts and decrease by ≥50% over pretreatment; cellularity and morphology not relevant. mCR was defined as Bone marrow: ≤5% myeloblasts and decreased by ≥50% over pre-treatment PB. Percentages were rounded off to the nearest single decimal place. All participants in Phase 2 were evaluated by the Investigator for CR/PR/mCR regardless of bone marrow blasts at baseline., Up to 5 years in Phase 2|Phase 3: Percentage of Participants With CR, PR, or mCR as Per IWG Response Criteria 2006 as Assessed by the Independent Review Committee (IRC), As per the IWG Response Criteria 2006, CR was defined as Bone marrow: ≤5% myeloblasts with normal maturation of all cell lines; PB: Hb ≥11 g/dL; platelets ≥100 x 10\^9/dL; neutrophils ≥1.0 x 10\^9/liter; blasts: 0%. PR was defined as Bone marrow: ≤5% myeloblasts and decrease by ≥50% over pretreatment; cellularity and morphology not relevant. mCR was defined as Bone marrow: ≤5% myeloblasts and decreased by ≥50% over pre-treatment PB. CR, PR and mCR were assessed by IRC in Phase 3 and participants were required to fit at least one of the following criteria (participants with \>5% baseline blasts per central pathology reviewer assessment; participants with CR, PR, mCR, or cytogenetic response as assessed by the investigator) and have at least one post-baseline assessment., Up to 3.7 years in Phase 3|Phase 2 and Phase 3: Overall Survival (OS), OS was defined as the interval from Study Day 1 to death from any cause. Survival time of living participants was censored on the last date a participant is known to be alive or lost to follow-up. The Kaplan-Meier method was used to estimate overall survival., Up to 6.6 years in Phase 2 and up to 4 years in Phase 3|Phase 2 and Phase 3: Progression Free Survival (PFS), Progression free survival was defined as the time interval from study Day 1 to the first date of disease progression or death from any cause, whichever occurs first. Disease progression as per IWG criteria was defined as: at least one of the following: at least 50 % decrement from maximum response levels in granulocytes or platelets; reduction in hemoglobin by ≥1.5 g/dL; transfusion dependence., Up to 6.6 years in Phase 2 and up to 4 years in Phase 3|Phase 2 and Phase 3: Time to Progression to Acute Myeloid Leukemia (AML), Time to progression to AML was defined as the interval from Study Day 1 to the date of AML diagnosis. Participants who did not progress to AML and were still alive at the cutoff date for the analysis or who withdrew from the study (withdrawal of consent or lost to follow-up), data was censored at the date of the last disease evaluation., Up to 6.6 years in Phase 2 and up to 4 years in Phase 3|Phase 2 and Phase 3: Amount of RBC Transfusions in the Best 8-week Interval, Amount of RBC transfusions for 8-week interval was defined as the total number of RBC transfusion units in a given 8-week interval during study. The best 8-week interval is a post-baseline 8-week interval where the participant had the fewest post-Study Day 1 RBC transfusion units. A valid 8-week period must start before the date of last dose of study drug + 30 days or end of treatment (EOT) visit whichever occurs first and ends before the first transfusion in post-treatment follow-up or the first day of subsequent anti-cancer therapy whichever occurs first., Up to 5 years in Phase 2 and up to 3.7 years in Phase 3|Phase 2 and Phase 3: Percent Change in RBC Transfusions Relative to Prior Transfusion Burden, Relative percent change in RBC transfusions per 8-week = (amount of RBC transfusions per 8-week - prior RBC transfusion burden) / prior RBC transfusion burden multiplied by 100%. Prior RBC transfusion burden was defined as the maximum number of RBC units transfused over any consecutive 8 weeks prior to study entry., Up to 5 years in Phase 2 and up to 3.7 years in Phase 3|Phase 2 and Phase 3: Percentage of Participants Who Received Any Myeloid Growth Factors, Percentage of participants who received any myeloid growth factors starting from Study Day 1 were reported. Percentages were rounded off to the nearest single decimal place., Up to 5 years in Phase 2 and up to 3.7 years in Phase 3|Phase 2 and Phase 3: Duration of Myeloid Growth Factors Administration, Duration of myeloid growth factor administered starting from Study Day 1 was reported., Up to 5 years in Phase 2 and up to 3.7 years in Phase 3|Phase 2 and Phase 3: Maximum Observed Plasma Concentration (Cmax), As pre-specified in the statistical analysis plan (SAP), participants in the imetelstat sodium arm group of Phase 2 and Phase 3 were pooled for pharmacokinetic (PK) data collection and analyses in this outcome measure. PK parameters were determined by population PK model., Pre-dose on Cycle 1 Day 1 and pre-dose on Day 1 of every 3 cycles from Cycle 4 up to Cycle 66 in Phase 2 and Cycle 34 in Phase 3 (each cycle length= 28 days)|Phase 2 and Phase 3: Area Under the Drug Concentration-Plasma Time Curve From Time Zero to Time 28 Days (AUC0-28d), As pre-specified in the statistical analysis plan (SAP), participants in the imetelstat sodium arm group of Phase 2 and Phase 3 were pooled for PK data collection and analyses in this outcome measure. PK parameters were determined by population PK model., Cycle 1 (Days 1 to 28) (Cycle duration= 28 days)|Phase 2 and Phase 3: Percentage of Participants With Anti-drug Antibodies (ADA) to Imetelstat Sodium, As pre-specified in the SAP, participants in the imetelstat sodium arm group of Phase 2 and Phase 3 were pooled for immunogenicity data collection and analyses in this outcome measure. Percentages were rounded off to the nearest single decimal place., Pre-dose on Cycle 1 Day 1 and pre-dose on Day 1 of every 3 cycles from Cycle 4 up to Cycle 66 in Phase 2 and Cycle 34 in Phase 3 (each cycle length= 28 days)|Phase 3: Medical Resource Utilization Assessed Based on Percentage of Participants With Outpatient Medical Encounters, Outpatient medical encounters included various sites of care: a) emergency room (ER) visits, b) hospital outpatient visits, c) home care visit, d) visit to lab, e) visit to doctor's office, f) other visits. Percentages were rounded off to the nearest single decimal place., Up to 3.7 years in Phase 3|Phase 3: Medical Resource Utilization Assessed Based on Duration of Hospitalization, Hospitalization included any medical encounter defined as hospice, hospital inpatient department, and intensive care unit (ICU). Hospitalizations without end dates were not counted in the calculation of length of stay. If any participant had multiple readmissions, duration was calculated as the sum of all hospital stays., Up to 3.7 years in Phase 3|QTc Substudy: Change From Baseline in QT Interval by Fridericia's Correction Method (ΔQTcF), Baseline was defined as the mean of the measured ECG intervals collected at 3 time points (-1 hour, -0.5 hour, and 0 hour) prior to treatment administration on Cycle 1 Day 1 (Cycle length= 28 days), Baseline, Cycle 1, Day 1: 0.5, 1, 2, 4, 6, and 8 hours post-dose (cycle length= 28 days)","Extension Phase: Number of Participants With AEs, An adverse event (AE) was any untoward medical occurrence in a clinical study participant administered a medicinal product. An AE does not necessarily have a causal relationship with the treatment. An AE can therefore be any unfavorable and unintended sign (including an abnormal finding), symptom, or disease temporally associated with the use of a medicinal product, whether or not related to that medicinal product. AEs included clinically significant vital signs measurements, clinical laboratory values and electrocardiograms (ECGs) changes., Up to approximately 3 years in the extension phase|Extension Phase: Overall Survival, Up to approximately 3 years in the extension phase|Extension Phase: Progression Free Survival (PFS) Survival, Progression free survival will be assessed as the time interval from the end of the Phase 3 study until death, withdrawal of consent, study termination, or until a subject is lost to follow-up. As per IWG criteria disease progression is defined as: at least one of the following: at least 50 percent (%) decrement from maximum response levels in granulocytes or platelets; reduction in hemoglobin by greater than or equal to ≥1.5 g/dL; transfusion dependence., Up to approximately 3 years in the extension phase",Geron Corporation,,ALL,"ADULT, OLDER_ADULT",PHASE2|PHASE3,289,INDUSTRY,INTERVENTIONAL,"Allocation: RANDOMIZED|Intervention Model: PARALLEL|Masking: DOUBLE (PARTICIPANT, INVESTIGATOR)|Primary Purpose: TREATMENT",CR107947|63935937MDS3001|EU CTIS number|2015-002874-19,2016-01-12,2023-10-13,2026-10-13,2015-11-06,2025-03-25,2025-03-25,"UAB Comprehensive Cancer Center, Birmingham, Alabama, 35294, United States|Acrc/Arizona Clinical Research, Inc., Tucson, Arizona, 85715, United States|CBCC Global Research, Inc., Bakersfield, California, 93309, United States|UCLA Ronald Regan Medical Center, Los Angeles, California, 90095, United States|Yale-New Haven Hospital (YNHH) - Smilow Cancer Hospital, New Haven, Connecticut, 06510-3220, United States|BRCR Medical Center, Plantation, Florida, 33326, United States|University of South Florida (USF) - H. Lee Moffitt Cancer Center, Tampa, Florida, 33612, United States|Franciscan Health, Indianapolis, Indiana, 46237-8601, United States|St. Agnes Healthcare, Inc, Baltimore, Maryland, 21229-5201, United States|Center for Cancer and Blood Disorders, Bethesda, Maryland, 20817, United States|Washington University School of Medicine, Saint Louis, Missouri, 63110, United States|University of New Mexico Cancer Center, Albuquerque, New Mexico, 87131, United States|Icahn School of Medicine at Mount Sinai Program for the Protection of Human Subjects, New York, New York, 10029, United States|Columbia University Medical Center, New York, New York, 10032, United States|Weill Cornell Medical College-New York Presbyterian Hospital, New York, New York, 10065, United States|Cleveland Clinic Taussig Cancer, Cleveland, Ohio, 44195, United States|The Ohio State Comprehensive Cancer Center, Columbus, Ohio, 43210, United States|Prairie lakes Healthcare system, Inc, Watertown, South Dakota, 57201, United States|Vanderbilt University Medical - Hematology-Oncology, Nashville, Tennessee, 37232-6307, United States|Texas Oncology/Methodist Charlton Cancer Center, Dallas, Texas, 75237, United States|Simmons Comprehensive Cancer Center, Dallas, Texas, 75390, United States|Fred Hutchinson Cancer Research Center (FHCRC), Seattle, Washington, 98109-1024, United States|GZA Ziekenhuizen - Campus Sint, Wilrijk, Antwerpen, 2610, Belgium|AZ Sint-Jan Burgge-Oostende, Brugge, West-Vlaanderen, 8000, Belgium|Az Groeninge, Kortrijk, West-Vlaanderen, 8500, Belgium|ZNA Middelheim, Antwerpen, 2020, Belgium|ZNA Stuyvenberg Antwerpen, Antwerpen, 2610, Belgium|AZ Klina, Brasschaat, 2930, Belgium|Universitair Ziekenhuis Gent, Gent, 9000, Belgium|UZ Leuven - Campus Gasthuisberg, Leuven, 3000, Belgium|Tom Baker Cancer Centre, Calgary, Alberta, T2N 4N2, Canada|University of Alberta Hospital - Hematology Research, Edmonton, Alberta, T6G 2R3, Canada|The Ottawa Hospital, Ottawa, Ontario, K1G 8L6, Canada|Sunnybrook Health Sciences Centre, Toronto, Ontario, M4N 3M5, Canada|Princess Margaret Hospital, Toronto, Ontario, M5G 2L7, Canada|Jewish General Hospital, Montréal, Quebec, H3T 1E2, Canada|Fakultni nemocnice Brno, Brno, Brno-město, 625 00, Czechia|FN Hradec Kralove, Hradec Králové, 500 05, Czechia|FN Kralovske Vinohrady, Praha 10, 100 34, Czechia|Vseobecna fakultni nemocnice v Praze, Praha 2, 128 08, Czechia|Hopital de l'Archet, Nice, Alpes-Maritimes, 6202, France|CHU Tours, Tours, Centre, 37044, France|CHU de Limoges, Hopital Dupuytren, Limoges, Haute-Vienne, 87042, France|CHU de Grenoble - Hôpital Albe, La Tronche, Isère, 38700, France|CHRU Nancy Brabois, Vandœuvre-lès-Nancy, Meurthe-et-Moselle, 54511, France|CH Le Mans - HAEMATOLOGY, Le Mans, Sarthe, 72037, France|CHU de Poitiers, Poitiers, Vienne, 86021, France|Centre Hospitalier Universitai, Angers, 49100, France|CHRU de Lille - Hopital Claude Huriez - Maladies du Sang, Lille, 59037, France|CHU - HÃ´pital Saint Louis - H, Paris, Île-de-France, 75010, France|University Hospital Freiburg, Freiburg, Baden-Württemberg, 79106, Germany|Fachärztliche Gemeinschaftspraxis mit Schwerpunkt, Dresden, Sachsen, 1307, Germany|University Hospital Leipzig, Leipzig, Sachsen, 4107, Germany|Studienzentrum für Hämatologie, Onkologie,Diabetologie, Endoskopie und Fußambulanz, Aschaffenburg, 63739, Germany|University Hospital Bonn, Bonn, 53127, Germany|Universitatsklinikum Carl Gustav Carcus Dresden, Dresden, 01307, Germany|Universitätsklinikum Düsseldorf, Duesseldorf, 40225, Germany|Johannes Gutenberg Universität, Mainz, 55131, Germany|Kaplan Medical Center, Reẖovot, Hagalil Saint, 7610001, Israel|The Edith Wolfson Medical Center, H̱olon, HaMerkaz, 58100, Israel|Meir Medical Center, Kfar Saba, HaMerkaz, 44281, Israel|Ha'Emek Medical Center, Afula, HaZafon, 1834111, Israel|Tel Aviv Sourasky Medical Center, Tel Aviv, Tel-Aviv, 49372, Israel|The Chaim Sheba Medical Center, Tel HaShomer, Tel-Aviv, 5265601, Israel|Carmel MC, Haifa, 3436212, Israel|Hadassah Medical Organization, Jerusalem, 9112001, Israel|Rabin Medical Center, Beilinson Hospital, Petah Tikva, 4941492, Israel|A.O. Ospedale Niguarda Ca' Granda, Milano, Lombardia, 20162, Italy|Istituto Clinico Humanitas Rozzano, IRCCS, Rozzano, Milano, 20089, Italy|Irccs Crob, Rionero In Vulture, Potenza, 85028, Italy|AOU Ospedali Riuniti Umberto I G.M. Lancisi G. Salesi, Ancona, 60020, Italy|AOU di Bologna Policlinico S. Orsola Malpighi, Bologna, 40138, Italy|Azienda Ospedaliera Universitaria Careggi di Firenze, Firenze, 50134, Italy|Grande Ospedale Metropolitano 'Bianchi-Melacrino-Morelli' Reggio Calabria, Reggio Calabria, 89124, Italy|A.O. Universitaria Policlinico Tor Vergata, Roma, 00133, Italy|AO S. Andrea, Università degli Studi di Roma La Sapienza, Roma, 189, Italy|Ospedale di Circolo, PO Varese, Varese, 21100, Italy|Gachon University Gil Medical Center - oncology, Incheon, Incheon Gwang'yeogsi, 21565, Korea, Republic of|Pusan National University Hospital - Hematology and Oncology, Seogu, Incheon, 42941, Korea, Republic of|Seoul National University Hospital, Seoul, Seoul Teugbyeolsi, 03080, Korea, Republic of|Chonnam National University Hwasun Hospital, Hwasun, South Jeolla, 58128, Korea, Republic of|Asan Medical Center, Seoul, 05505, Korea, Republic of|Samsung Medical Center, Seoul, 06351, Korea, Republic of|The Catholic University of Korea Seoul St. Mary's Hospital, Seoul, 06591, Korea, Republic of|Severance Hospital, Yonsei Uni, Seoul, 3722, Korea, Republic of|Radboud Umcn, Nijmegen, Gelderland, 6525 GA, Netherlands|Meander Medisch Centrum, Amersfoort, 3813 TZ, Netherlands|VU Medisch Centrum, Amsterdam, 1081 HV, Netherlands|Universitair Medisch Centrum Groningen, Groningen, 9713 GZ, Netherlands|Uniwersytecki Szpital Kliniczny im. J. Mikulicza-Radeckiego, Wrocław, Dolnoslaskie, 50-367, Poland|Centrum Medyczne Pratia Poznan, Skorzewo, Kościerzyna, 60-185, Poland|Wojewódzki Szpital Specjalistyczny sp.z o.o., Słupsk, Pomorskie, 76-200, Poland|SPZOZ MSWiA z Warminsko - Mazurskim Centrum Onkologii, Olsztyn, Warminsko-mazurskie, 10-228, Poland|Ars Medical sp. z o.o., Piła, Wielkopolskie Województwo, 64-920, Poland|Clinics of Samarskiy GMU, Samara, Volga, 443079, Russian Federation|Emergency Hospital of Dzerzhinsk, Dzerzhinsk, 606019, Russian Federation|City Clinical Hospital, Moscow, 129301, Russian Federation|Nizhniy Novgorod Region Clinical Hospital, Nizhny Novgorod, 603126, Russian Federation|Ryazan Regional Clinical Hospital, Ryazan, 390039, Russian Federation|FGU-Russian Research Institut, Saint Petersburg, 191024, Russian Federation|Oncologic Dispensary No.2, Sochi, 354057, Russian Federation|H.U.Pta.del Mar, Cadiz, Cádiz, 11009, Spain|Hospital Universitario Puerta de Hierro Majadahonda, Majadahonda, Madrid, 28222, Spain|Hospital de Cruces, Baracaldo, Vizcaya, 48903, Spain|Hosp. Univ. Germans Trias I Pujol, Badalona, 08916, Spain|Hosp. Univ. Vall D Hebron, Barcelona, 08035, Spain|Hosp. Gral. Univ. Gregorio Maranon, Madrid, 28007, Spain|Hosp. Univ. La Paz, Madrid, 28046, Spain|Hosp. Clinico Univ. de Salamanca, Salamanca, 37007, Spain|Hospital Universitario Nuestra Señora de Valme, Sevilla, 41014, Spain|Hospital Universitario Doctor, Valencia, 46017, Spain|Hospital Universitari i Politecnic La Fe, Valencia, 46026, Spain|University Hospital in Basel, Basel, Basel-Stadt (de), 4031, Switzerland|Kantonsspital St. Gallen - Onkologie/Hämatologie, Saint Gallen, Sankt Gallen, 9007, Switzerland|Inselspital - Universitätsspital Bern, Bern, 3010, Switzerland|Universitaetsspital Zuerich, Zuerich, 8091, Switzerland|Ankara University Medical Faculty - Hematology, Ankara, Anatolia, 6590, Turkey|Cukurova University Medical Faculty, Adana, 1330, Turkey|Ege Universitesi Tip Fakultesi - Hematology, İzmir, 35040, Turkey|KZ ""Miska bahatoprofilna klinichna likarnia No4"", hematolohi, Dnipropetrovs'k, Dnipropetrovs'ka Oblast', 49102, Ukraine|Instytut patolohii krovi ta transfusiynoi medytsyny NAMN Ukr, Lviv, L'vivs'ka Oblast', 79044, Ukraine|KNP ""Cherkaskyi oblasnyi onkolohichnyi dyspanser Cherkaskoi, Cherkasy, 18009, Ukraine|Nottingham City Hospital - Clinical Haematology, Nottingham, Nottinghamshire, NG5 1PB, United Kingdom|Aberdeen Royal Infirmary, Aberdeen, AB252ZL, United Kingdom|The Leeds Teaching Hospitals NHS Trust, Leeds, LS9 7TF, United Kingdom|Southampton University Hospital, Southampton, SO16 6YD, United Kingdom","Study Protocol, https://cdn.clinicaltrials.gov/large-docs/61/NCT02598661/Prot_000.pdf|Statistical Analysis Plan, https://cdn.clinicaltrials.gov/large-docs/61/NCT02598661/SAP_001.pdf"
